parent_post_id,text,source,subreddit,keyword,post_title
5j16nd,It looks like they are behind on banning people. Usually [this](http://imgur.com/MAqsCnN) is enough.,comment,MensRights,feminism,How to get banned from r/Feminism
5j16nd,"""Feeling safe"" is how we ended up with the TSA and their useless security theatre. ",comment,MensRights,feminism,How to get banned from r/Feminism
5j16nd,"This kind of post is normally removed as it violates our subreddit policies. However, I have been travelling and didn't see it. At this point, with the number of participants and comments, removing it would also have a detrimental effect to that valuable discussion. As a result, I will be leaving this up.

Those who continue to report it won't be satisfied with the response.",comment,MensRights,feminism,How to get banned from r/Feminism
5j16nd,"I don't actually agree with what OP says in his argument. However, it is a valid argument and I don't see why he should be banned for it. So I tried to post a PNG of this, with the title ""Is it right to ban people we don't agree with"". Guess what? I got banned.",comment,MensRights,feminism,How to get banned from r/Feminism
5j16nd,"Female 50 here, I tend to agree that ensuring people are safe is more important than trying to make them feel safe.  I think being safe is a generic male and female, adult and child, issue but what makes someone feel safe is an individual issue.  I don't think we can guarantee anyone's safety but we should strive to create a society where everyone is valued and in that valuation people are made safe because if you value something you tend to protect it and keep it safe.  I think it was inappropriate to ban you for raising a point of view which was not particularly offensive, derogatory or anti women.",comment,MensRights,feminism,How to get banned from r/Feminism
5j16nd,"Isn't intimidation and coercion illegal?  By doing either, you're not physically hurting someone, just making them *feel* unsafe enough to do your bidding.  

So, depending on how you look at it, they may have a point.  But shutting down the discussion and banning someone making an opposing point is retarded.  ",comment,MensRights,feminism,How to get banned from r/Feminism
5j16nd,"I have been a feminist since age 9. I was banned for suggesting an abused woman should have left a man who, among other things, got a neck tattoo of her name two months after they met.  She ignored red flags, I muttered something about taking responsibility and...banned.",comment,MensRights,feminism,How to get banned from r/Feminism
5j16nd,"Almost all subreddits strive to become echo chambers, while simultaneously condemning them. To be honest, that also includes this one. What seems like a reasonable, justified ban in one subreddit is often easily spun to look very much the opposite in another one.

In this case, OP went into /r/feminism and spoke out against the notion that women have a right to *feel* safe. To us it looks a lot like OP was banned for saying something that makes perfect sense - you can't just claim that you are supposed to feel safe without a reasonable basis behind it. To them, it probably looks a lot like OP is promoting behaviour that is technically legal but considered sexist. Think stuff like cat calling. If you're a woman walking out during the evening and you pass by a group of men that cat call you - you're going to feel very unsafe although statistically the chances of them doing anything illegal in this situation is very low. That's the type of ""feel safe"" that /r/feminism consider obvious and that it looked to them as if OP was arguing against, even though I bet most of us in here would agree that no woman should feel unsafe while out and about on her own because other people act like pigs around her.

EDIT: Lots of good responses coming in. Allow me to clarify a few things.

Cat calling as a behaviour should not be outlawed. I believe however that we men have a greater responsibility to speak up against it. Likewise, women cat calling should also be spoken up against. The behaviour isn't harmful per se but it really doesn't fit in a modern society in my opinion. If somebody wants to do it, that is fine I guess? But right now a lot of people seem to be convinced the behaviour is okay.

No, OP should not have been banned. That was sort of the point with this comment. I think both OP and the /r/feminism user had valid thoughts on the matter but due to OP being banned it seems that he had no option to clarify that and make them understand.

And no, I don't actually think this subreddit is ban happy in particular. When I type ""strive to become"" the word 'subconsciously' fits in there too. What I mean is that hivemind thinking is commonplace here as with most other subs and this caused us to view stuff one sided, as I believe this post to be an example of.",comment,MensRights,feminism,How to get banned from r/Feminism
5j16nd,"That makes way too much sense for that sub, they couldn't handle it",comment,MensRights,feminism,How to get banned from r/Feminism
5j16nd,"What does this have to do with Men's Rights? Aren't we pro-men's rights, not anti-feminism?",comment,MensRights,feminism,How to get banned from r/Feminism
5j16nd,"Before I ask this I should clarify; I hate the whole bullshit radical feminism movement, as you all do. I believe a lot of those feminists are whining about bullshit. I agree with a lot of things posted here, And no I'm not some green haired liberal cuck, just trying to have a civil discussion because I'm confused.

Why should someone not feel safe walking down the street? There may not be anything to warrent panic, but why shouldn't people feel safe in society? ",comment,MensRights,feminism,How to get banned from r/Feminism
5j16nd,"Yeah, I got banned for something similar. Was having an argument with someone about crime against women (I think?) and how there's never been a safer time for women (or the rest of us) in western civilization. I quoted a few sources proving my point and asked if they truly believe that civilization 20, 50, 100, 250, or 500 years ago was safer? 

She replied that my idea and sources were good, but she still *feels* like she isn't as safe as before and that's all that matters. I was banned shortly after. ",comment,MensRights,feminism,How to get banned from r/Feminism
5j16nd,"This is dumb, but it's not a Men's Rights thing. Men's Rights are not at war with Women's. ",comment,MensRights,feminism,How to get banned from r/Feminism
5j16nd,"I'm glad this is a safe space for us to share diversity of opinions.

/r/feminism is rendered unsafe by censorship. 

The admins should step in and ban that entire subreddit.
 
(Just kidding, I support their right to their bigotry )
",comment,MensRights,feminism,How to get banned from r/Feminism
5j16nd,"Was banned myself. Go figure. 

As a male, you can participate in only three ways within r/Feminism:

1. You can say nothing. This means you are part of the problem you misogynistic piece of shit. 

2. You can agree that women have legitimate issues and point out how men face the same issues sometimes, and other issues other times. Men face issues? I don't think so, you misogynistic piece of shit. 

3. You can grovel and apologize for your very existence and agree wholeheartedly with every single thing your feminist masters say. Repeat. Repeat. Repeat. You're still a misogynistic piece of shit, but we'll let you stay and carry heavy things for us. ",comment,MensRights,feminism,How to get banned from r/Feminism
5j16nd,Echo^chamber^^chamber^^^chamber^^^^chamber^^^^^chamber^^^^^^chamber,comment,MensRights,feminism,How to get banned from r/Feminism
5j16nd,Their comment didn't deserve to be downvoted by you op. Please don't downvote just because you disagree.,comment,MensRights,feminism,How to get banned from r/Feminism
5j16nd,"Definitely not on either side here. And also have no cobext. But if your feelings of safety were irrelevant we would have intimidation laws. ""But Officer there were no bullets in the gun, he was never in any real danger."" You can completely ruin a person's life by keeping them in a state of fear. Hence anti-stalking laws. Even certain types of torture like fake executions are on the no no list. A feeling is very relavent. Consider the issue of Police Officers using lethal force, they have to *feel* threatened.       
So feelings are important.  It just raises a more complex question of ""was your feeling reasonable?"". If there isn't some guideline and restraint we'd all be at the mercy of over reactors. (Not real) example: 12 year comes at cop with a whiffle bat. If the cop is not very brave can they claim the felt threatened enough to use lethal force? Let's hope not.      
Ignoring feelings is just wanting things to simpler then they are. Things should be as simple as possible, but no simpler.",comment,MensRights,feminism,How to get banned from r/Feminism
5j16nd,This can be both correct and incorrect entirely depending on context. If you work at a gas station and someone robs you with an unloaded gun you will be safe. You will definitely not feel safe though. If a woman is afraid she will get raped by ever man she meets she probably needs therapy more than anything.,comment,MensRights,feminism,How to get banned from r/Feminism
5j16nd,Isn't it really important for citizens of our nation to feel safe and secure? What am I missing?,comment,MensRights,feminism,How to get banned from r/Feminism
5j16nd,"[Word cloud out of all the comments.](http://i.imgur.com/Fd5YKcq.png)

I hope you like it",comment,MensRights,feminism,How to get banned from r/Feminism
5j16nd,If you aren't in on the circle jerk be prepared to be banned,comment,MensRights,feminism,How to get banned from r/Feminism
5j16nd,"Oh! 

Can I also be banned from r/Feminism !!!

Please????",comment,MensRights,feminism,How to get banned from r/Feminism
5j16nd,This is my first time posting in this sub but honestly this is pretty stupid. Society actually does make an effort to make people feel safe and it's fine they do. There's a point where it can get in the way of free speech and that I disagree with.,comment,MensRights,feminism,How to get banned from r/Feminism
7tkj3y,"True. They face ""serious"" problems. That doesn't mean women here can't still fight for equality and respect because they aren't being forced into marriages. 

Everything is relative. Just because someone has it worse than others doesn't mean people should accept their lot in life as 'good enough'. ",comment,MensRights,feminism,What real feminism is
7tkj3y,"Not that I should be surprised, but the lack of self-awareness here is really funny.

So using the standard that ""real"" -isms are based on real life action rather than complaining...

This post either *isn't* real men's rights activism, because all it's doing is complaining that feminism is too shallow...

Or it *is* real men's rights activism, verifying that all it is (by this subreddit's standards) is complaining about feminism.",comment,MensRights,feminism,What real feminism is
7tkj3y,"Nice strawman, obviously all Western feminists are malformed troll people, because ""real"" feminism can only exist in third-world countries where women are basically used as currency. And what exactly does this have to do with men's rights? Are y'all saying that men have so few problems that tearing down women's issues is all that's left?",comment,MensRights,feminism,What real feminism is
7tkj3y,"Did this thread get brigaded? There's an unusual influx of people who have never posted here before, and they're all upvoted to the top.",comment,MensRights,feminism,What real feminism is
7tkj3y,#IBelieveEverythingIReadOnTheInternetAboutHowWonderfulWomenAreBecauseNoOneLiesAbutThatEver,comment,MensRights,feminism,What real feminism is
7tkj3y,"I agree, we need more women with her spirit here in the west",comment,MensRights,feminism,What real feminism is
7tkj3y,"So real ""Men's Rights"" should be helping men instead of just bitching about feminism right?",comment,MensRights,feminism,What real feminism is
7tkj3y,"As a woman of south Asian descent, I totally agree with this. ",comment,MensRights,feminism,What real feminism is
7tkj3y,I'd love to meet her. I would just sit and listen and absorb everything. ,comment,MensRights,feminism,What real feminism is
7tkj3y,"Are we also going to admit that arranged and child marriages are still a thing in the USA? It isn't nearly as common, but it still is happening. ",comment,MensRights,feminism,What real feminism is
7tkj3y,"For fuck's sake, stop trying to validate and legitimize feminism, which was a destructive marxist experiment from the get-go. African women fighting for other women in Africa is not ""real feminism"". Real feminism is Andrea Dworkin, Anita Sarkeesian and Amanda Marcotte vomiting their mental illnesses all over the place, trying to sow animosity between men and women, breaking up the traditional family, and destroying social cohesion. If you tie them to honorable things other people do, it will just make it harder for outsiders to realize what's going on in the west under the banner of feminism.",comment,MensRights,feminism,What real feminism is
7tkj3y,Thank god there are so many men to explain what feminism is!,comment,MensRights,feminism,What real feminism is
7tkj3y,"Every time I see this sub on /r/all it's some cringeworthy shit like this. 

You guys are all miserable fucks, aren't you?",comment,MensRights,feminism,What real feminism is
7tkj3y,"It makes me sad that when feminism is brought up its immediately tied together with women bitching about manslreading and other random, tiny things that only a small percentage of women actually take the time to complain about. 

There are still women out there advocating mens and womens rights, as that is supposed to be the whole point of feminism. While it cant be as extreme as what this woman is doing because of our western society, there are still harmful stigmas out there that need to be broken down. Women should be able to feel empowered and have control over their own body and men should be able to express their other emotions without being told to man up or told to believe that men being raped are nonexistent. Thats what these protests are for, what the women’s march that just happened was for. 

Everyone should be able to come together and tackle these issues and instead of focusing on the trolls who complaing about manspreading and mansplain it would just be better to put our attention and effort into other issues. ",comment,MensRights,feminism,What real feminism is
7tkj3y,You can always tell a post hit /r/all when you have all the screeching feminists attacking men and insisting how oppressed women in the west are.,comment,MensRights,feminism,What real feminism is
7tkj3y,"Yup, glad we do have humans in the world like this... We could use a few more",comment,MensRights,feminism,What real feminism is
7tkj3y,"What ridiculous strawman, using an unambiguously positive humanist act as somehow being about feminism which is somehow about men's rights. ",comment,MensRights,feminism,What real feminism is
7tkj3y,"That's not ""feminism""

That's a women who has never even heard of ""feminism"".

That's just a human being trying to be a decent person.

Women can do good things without being ""feminists"".

Women can, oh I don't know, be successful business managers without actually being ""feminists"". Wow!

Men can do things that help women without being ""feminists"".

There's no reason to put in huge effort to try to find an example of a decent human being who is actually a ""feminist"".

Try travelling outside of the western world. Millions of women go to work every day without ever thinking about feminism. They start families or do not without ever thinking about feminism. They go to a gym or don't go to a gym without ever thinking about feminism.

On planet earth, the normal way of life for most women is to work hard and do good things and never even pay attention to the worthless garbage that is ""feminism"".",comment,MensRights,feminism,What real feminism is
7tkj3y,Someone has to aknowledge the hipocrisy that this post shows?,comment,MensRights,feminism,What real feminism is
7tkj3y,"Real feminists are not found in the West. Just entitled, bitter, ugly women who want attention.",comment,MensRights,feminism,What real feminism is
7tkj3y,"Posting this in r/feminism
Wish me luck bois

 Edit: as expected I was banned within half an hour of posting. ",comment,MensRights,feminism,What real feminism is
7tkj3y,Congratulations on making this woman's incredible accomplishments all about you and your entitled whining.,comment,MensRights,feminism,What real feminism is
1kwydhv,"As an ex muslim woman i think we have to talk about it because girls are heavily indoctrinated and as a society we should offer them the possibility of considering an alternative lifestyle and the opportunity to live it, and we're currently not doing that. The only way I gathered the courage to leave the only world I knew back then was because my life was so difficult that I would rather die than stay. So I took my kids and fled.

Everyone is playing pretend because they're scared.",comment,Feminism,feminism,Can we stop acting like Islam isn’t terrible for women
1kwydhv,"Coming from a muslim girl myself, can confirm its true. I think all religions are inherently anti women.",comment,Feminism,feminism,Can we stop acting like Islam isn’t terrible for women
1kwydhv,"I remember having a classmate whose family were strict Muslims. According to them, they were part of a ""clan"".

She told me that she wasn't allowed to be seen with a boy anywhere because the people in the clan had photos of all the girls and regularly drove around the town to check that they weren't going out with boys.

I remember our teacher taking us for ice cream once, and she had to walk 50 metres behind the class to avoid being seen with boys.

It's sickening. Call me islamophobic I don’t care. Islam like all abrahamic religions is a tool to oppress women.",comment,Feminism,feminism,Can we stop acting like Islam isn’t terrible for women
1kwydhv,"I hate the double standard where only christianity is attacked but judaism and islam get a pass when they are just as worse if not even more bad by today standards...

They all are just oppressive towards women and help the patriarchy and help enfore toxic attitudes in society.

Please remember people that states where islamic law rules the state lgbtq people are getting thrown off roofs and women are  getting beheaded and thrown stones at.
Domestic abuse is very common there.

There are countries where women can't leave their home if they don't wear burkas or at the very least hijabs.

I know a woman that went to jail for exposing her ankles",comment,Feminism,feminism,Can we stop acting like Islam isn’t terrible for women
1kwydhv,"Tbh every. single. religion. is bad for women. In the Bible there's a women getting stoned because she was raped, women are ""Eve"" and have to pay for her sins for eternity etc. Women always lose.",comment,Feminism,feminism,Can we stop acting like Islam isn’t terrible for women
1kwydhv,I can’t think of a single religion that isn’t terrible to women. All theocracies need to be demolished,comment,Feminism,feminism,Can we stop acting like Islam isn’t terrible for women
1kwydhv,"Every religion is bad. I think main problem is that, at least in western progressive circles, it's ok to point out how discriminatory and opressive is Christianity. Meanwhile Judaism and Islam seem to be more of a taboo - despite not being any better.",comment,Feminism,feminism,Can we stop acting like Islam isn’t terrible for women
1kwydhv,"Every religion is horrible for women & if you call it out, they dance around it by saying women are happy to be subservient to men & it’s just how *insert their god* wants it to be",comment,Feminism,feminism,Can we stop acting like Islam isn’t terrible for women
1kwydhv,"It’s not just Islam. Is there any religion that isn’t misogynistic? They’re all garbage.

That thing with Islam is that Muslim countries are still very much stuck in the past, so that makes us pay more attention. But make no mistake, Christianity and Judaism are just as terrible.",comment,Feminism,feminism,Can we stop acting like Islam isn’t terrible for women
1kwydhv,">And I feel bad for Muslim women—they genuinely believe they’re intellectually deficient to men (as stated in their book).

Can we please not act like Muslim women are a monolith? Same goes for Islam and the ways in which people interpret and practise it.",comment,Feminism,feminism,Can we stop acting like Islam isn’t terrible for women
1kwy4z9,"Because men don't view women as equal human. They view us as a subservient. Yes, all men. Even those who think they are sure women are persons. It's very deep down in them. 
There's interesting topic which discusses that men even erased most goddesses from religion, for example Greek goddesses. Zeus could be a goddess originally, and Poseidon too. But men want the main gods to be men. 
The question isn't why all our culture is about centering the men. The question is why not be sure of what you perceive as a woman. The treatment you receive from men is exactly what's in their heads.",comment,Feminism,feminism,Why can’t we entertain the idea that women existed in the past?
1kwy4z9,"Because men are subconsciously insecure over the fact that they cant create life within themselves, and so theyre very protective over any other forms of creation because it hurts them too much to consider that women can create life within themselves while also being able to create all of the things men can.",comment,Feminism,feminism,Why can’t we entertain the idea that women existed in the past?
1kwy4z9,">The pebble was indisputably handled by a Neanderthal, and the print could possibl[y] correspond to an adult male, considering that, although there is no record of Neanderthal fingerprints in modern forensic databases, it is likely that morphological characteristics—such as size, stature, and robustness—which show significant variability in contemporary populations, do not differ substantially from those observed in Pleistocene populations of Homo sapiens and Neanderthals.

https://link.springer.com/article/10.1007/s12520-025-02243-1#Sec19

They're not randomly assuming it was a man just for the sake of dicking on women, they're going by the available evidence.",comment,Feminism,feminism,Why can’t we entertain the idea that women existed in the past?
1kwtn3p,"Bit simplistic and not the most productive take, but I don't disagree at the core",comment,Feminism,feminism,Feminism starts with anti-capitalism
1kwtn3p,I don't support capitalism but I don't think that without capitalism we would be free of misogyny,comment,Feminism,feminism,Feminism starts with anti-capitalism
1kwtn3p,All economic systems have embedded misogyny because they are all developed in a patriarchal system.,comment,Feminism,feminism,Feminism starts with anti-capitalism
1kwtn3p,"This is basically the idea that in order to dismantle the patriarchy, you need to abolish capitalism. 

Capitalism functions to serve the dominant group in power (white, cis-gendered, able bodied men), and oppress all the other group under the guise of the ‘free market’. 

I agree with the first part, not some much the second. 

The second part should be ‘ then maybe read some articles, I would recommend this book…’ haha.",comment,Feminism,feminism,Feminism starts with anti-capitalism
1kwtn3p,"Capitalistic reproduction of inequalities should be acknowledged and critiqued. There should be a call for its abolition however it is important to recognise that women's liberation is not guaranteed by the end of capitalism alone. Patriarchy has predated capitalism. You are overlooking the fact that the root cause of women’s oppression since the dawn of time has been patriarchy. Also it is the patriarchal system that has birthed the structures that produce and reproduce capitalistic inequality. Even if capitalism was to be overthrown, the patriarchal order would ensure the continuation of the cycle of women’s exploitation is some other form. Women's liberation depends on the dismantling of the patriarchal structure.",comment,Feminism,feminism,Feminism starts with anti-capitalism
1kwtn3p,"This is just a tactic men use to convince feminists to put all their efforts into abolishing capitalism instead of helping women.

Sounds great, except that abolishing capitalism does nothing at all to abolish misogyny.",comment,Feminism,feminism,Feminism starts with anti-capitalism
1kwtn3p,"This makes me think of choice feminism, which I find to be very silly and idiotic. No, getting a boob job for example is not a feminist act because you, a woman, chose to do it. Saying that type of thing completely erases the systems of oppression (capitalism & patriarchy) that played the primary role in you making the choice. Not acknowledging these systems is the opposite of feminism. Get the boob job if you want and you shouldn’t be admonished for it, but know that there’s nothing feminist about it.",comment,Feminism,feminism,Feminism starts with anti-capitalism
1kwtn3p,"I think this is true. I have seen so many underqualified (white) women. Capitalism worsens racism, plutocracy and all sorts of inequality and it always puts women at risk the most. Sick",comment,Feminism,feminism,Feminism starts with anti-capitalism
1kwtn3p,mOrE gIrLbOsS cEoS is a mindset I'm glad isn't popular in Internet spaces I exist in.,comment,Feminism,feminism,Feminism starts with anti-capitalism
1kwtn3p,"True. 

But also capitalism and all oppressive systems are rooted in patriarchy.",comment,Feminism,feminism,Feminism starts with anti-capitalism
