parent_post_id,text,source,subreddit,keyword,post_title
1j8jxdz,"That’s one strand of feminism—not the whole movement. Many feminists do want equality of the sexes, and dismissing that as ‘just liberal feminism’ ignores the real progress that fight has made. You don’t get to redefine an entire movement just because your version is more radical. Feminism isn’t a one-size-fits-all ideology—and pretending it is shuts down real conversation.",comment,Feminism,feminism,"Feminism is NOT equality of sexes, that is liberal feminism."
1j8jxdz,so what happens to transgender people like myself if you abolish gender? do we just not exist anymore AGAIN?,comment,Feminism,feminism,"Feminism is NOT equality of sexes, that is liberal feminism."
6rk124,"Wrong, wrong, wrong, wrong, wrong, wrong. 

Suffrage should have ""Communists, racists, supremacists and terrorists"" to their labels, as all of these things are applicable onto them. I'm sorry but ""suffrage"" was NOT the kind ol' granny you think it was. It was a horrible, racist, sexist and vile movement that used the falsehood that women are weak to push their agenda. ",comment,MensRights,feminism,The three waves of feminism: quick reference guide
6rk124,"This is whitewashing a lot of what these ""waves"" actually did, or sometimes more importantly, didn't do. The first wave included literal terrorists, were counter productive in securing female suffrage, and either pushed or condoned seriously lopsided laws. Some of the most anti-male rape hysteria feminists are in the second wave and solidified so many ant-male domestic violence and rape myths. And the third is just the icing on the cake combining them all. If it weren't for critical statements on the Third Wave, and The Aftermath, I would think this to be a feminist propaganda image.",comment,MensRights,feminism,The three waves of feminism: quick reference guide
6rk124,"The aftermath is labeled wrong.

Do you really think they'll take responsibility for what they've done? 

No. They'll blame the patriarchy.",comment,MensRights,feminism,The three waves of feminism: quick reference guide
6rk124,"The myth of the ""pure beginnings"" of Feminism that has merely been lost and corrupted. If only it could be redeemed! 

Feminism has always been garbage. Suffragettes were trash. I won't pretend I care to elaborate though if you want to challenge that assertion. Karen Straughan already does a much better explanation of the topic than I ever would though. Just look into her talks on the topic.",comment,MensRights,feminism,The three waves of feminism: quick reference guide
6rk124,"The term ""feminism"" didn't arise until the 1890s, by then the worst of coverature had been overturned, women already had the vote in some states and Earnest Belfort Bax had even written ""The Legal Subjection of Men"". It was an unneccessary gender warfare hijacking of an already-existing and already ground-gaining idea of gender equality, right from the very beginning.",comment,MensRights,feminism,The three waves of feminism: quick reference guide
6rk124,"[Feminism was always bigoted ideological garbage](https://www.youtube.com/watch?v=VMkWdpFSXPA&list=FLUwulqnSvTEXpkSCWmBsP9Q&index=1), stop spreading misinformation and propaganda, [learn about the history.](https://en.wikisource.org/wiki/The_Fraud_of_Feminism)",comment,MensRights,feminism,The three waves of feminism: quick reference guide
6rk124,"I'm sorry, can anyone explain to me the reasoning in the progression from deluded rage against men to oppressive submission to men?

I guess you're suggesting that the extremist form of third wave feminism will provoke a backlash... which it certainly will... but to suggest that it will take the form of total cultural, intellectual, spiritual, and moral regression is absurd.

Yes I love all people, no I'm not racist.

That being said the behavior in the middle east is definitely primitive, and I don't see that sort of de-evolution to be possible for humanity considering how we've managed to collect and store our societal understandings thus far.",comment,MensRights,feminism,The three waves of feminism: quick reference guide
6rk124,People need to stop thinking feminism's start was noble. It was a movement ran by rich women who were bored. ,comment,MensRights,feminism,The three waves of feminism: quick reference guide
6rk124,"This is wrong, at least in the first two sections.

Currently cultural mores, and the distance of history, have allowed the First and Second waves to appear far more sensible and equality-minded than they actually were.

The First Wave shamed men (and only men) to go and die in senseless WWI.  

The Second Wave invented ""political lesbianism"" which set back gay rights at least two decades in the USA by convincing everyone that being gay was a choice.  For most men, it certainly is not.  I support the liberty of anyone to have gay sex, but the reality is that most people doing so will be gay/bi through biology, not some whim.",comment,MensRights,feminism,The three waves of feminism: quick reference guide
6rk124,"First wave: Wanted men's rights, but rejected men's responsibilities.

Second wave: reduced women's responsibilities to society.

Third wave: increasing men's responsibilities to women.

No wave of feminism was about ""equality"".",comment,MensRights,feminism,The three waves of feminism: quick reference guide
6rk124,I like this guide but the third wave and aftermath captions could be written more clearly.  Maybe we could make a new one?,comment,MensRights,feminism,The three waves of feminism: quick reference guide
6rk124,"Feminism was pretty dominant within ""traditional"" politic parties in northern Europe earlier than in the USA as far as I know. That's why, i suppose, the countries up here are more feminist.",comment,MensRights,feminism,The three waves of feminism: quick reference guide
6rk124,"Well it's factually incorrect but it's the way a lot of people here THINK it was.

So what's this really about if it's not about facts?  It's about finding a way to apologize for attacking feminism because MRAs reach the conclusion that feminism is the enemy (true) but want to excuse or justify it by manufacturing a time in the past where they claim feminism was OK, and then praising THAT fictional feminism. See? I'm not really against feminism because I liked the fictional version.

Why this is counter-productive: because you don't defeat an enemy by praising and defending them.",comment,MensRights,feminism,The three waves of feminism: quick reference guide
6rk124,"First of all, this is historically inaccurate. 

Second of all, ""cultural marxism"" is a conspiracy theory.",comment,MensRights,feminism,The three waves of feminism: quick reference guide
6rk124,"Not bad, but come on  do you really think ISIS is going to conquer America?  Our economy is 1000 times larger than theirs, for one thing.",comment,MensRights,feminism,The three waves of feminism: quick reference guide
6rk124,"Feminism does not equal women's rights, this diagram is wrong.",comment,MensRights,feminism,The three waves of feminism: quick reference guide
6rk124,"The 1st wave was to give women the privilege of men without equality or responsibility. The 2nd was to equal women still without responsibility. The 3rd to give women more rights more privileges and to de-masculate men still without the equal responsibility. Men are expected to work more or do the harder work, be more educated, protect women with their life and pay for dates, bills, fix the house and cars. ",comment,MensRights,feminism,The three waves of feminism: quick reference guide
6rk124,"Missing one important point. 

At all stages, influenced and controlled by [Jewish cultural Marxists](http://i.imgur.com/wpRhqlk.jpg) using them as a stalking horse to [undermine western civilization.](http://i.imgur.com/X0Yhyko.jpg)

Think that's bullshit? Then I'd love to hear your rationalization [for this.](https://en.m.wikipedia.org/wiki/Category:Feminists_by_ethnicity)",comment,MensRights,feminism,The three waves of feminism: quick reference guide
6rk124,"There is no such thing as cultural marxism - that's right wing propaganda and conspiracy theory.


What happened was postmodernism was seen as a good way to divide the left while underhandedly moving it to the right economically.

That's why it was spread in our colleges.

Feminists are only the useful idiots.



EDIT - look at the down votes - the ideology in this movement is rife.",comment,MensRights,feminism,The three waves of feminism: quick reference guide
6rk124,"Patriarchy doesn't mean men only doing bad things. Patriarchy means women too. It's a system that decides who does what and gives gender roles to men and women, that are actually harmful to both, like the fact that patriarchy teaches men that's crying and opening up is a weakness so this is the reason men ending up suicide more than women. Patriarchy is bad for all of us. Modern feminism deals mostly with rape victims, violence victims and supreced women in 3rd world countries, there are many npo with western feminists that actually help people in need right now. You people are just noticing the social justice warriors of the internet. Is different",comment,MensRights,feminism,The three waves of feminism: quick reference guide
1g2gx23,"Feminism reviewed by a woman. The mother of mens rights, Karen Straughn. 
https://youtu.be/AQWoNhrY_fM?si=jKNTKlMZF9ed2E1P",comment,MensRights,feminism,Men’s Opinions on Feminism?
1g2gx23,"I've spent a majority of my life as a feminist, completely supporting women in almost all cases.

Until I dared to open up to some of my long time (female) friends about some of the challenges I had socially as a man, as it's significantly harder to earn people's trust and keep it, and therefore keep friendships alive, especially with women.

I was promptly branded as an incel (even though it had nothing to do with sex or romantic relationships) and they publicly tried to ostracize and cancel me.

This (and similar experiences) opened my eyes to how extremely radical and toxic feminists are. They are poisoned with their hatred of men and are only capable of tolerating ones that are completely indoctrined with their beliefs that women are virtuous and can do no wrong, while men are inherently flawed and evil, and should actively be educated to be better.

So to answer your questions briefly, I don't see men's rights as a separate issue from women's. We should be vying for equality, which feminism does not stand for, despite claiming otherwise. It's a radical ideology powered by hatred and distrust of men. I don't get on edge talking to women on this issue, but I do grow distrustful when I detect dismissal. Ideally, we would stop this gender war and focus on true equality, but I've only seen that initiative on the men's side. Women are too busy trying to play the victim.",comment,MensRights,feminism,Men’s Opinions on Feminism?
1g2gx23,"I grew up in a feminist family. My mother officially identified as a feminist and she abused me. She was sexist, favoring my sister solely because of her sex. She took the same path of feminism as we grew up. I know a lot of feminists, many of whom I have known since my childhood. I can tell you for sure, all of them in conversations belittle men and say bad things about them. All of them are sexists against men. There are very few exceptions when they genuinely believe in true equality, but they are rare exceptions and usually don’t have any power. Feminism promotes abuse against men by ignoring the facts of male abuse and concentrating completely on female abuse. Not only do they ignore it, but many of them are also active abusers themselves, like my mother, for example, who daily tortured me because of my sex.

The childhood experience left me with a deep-seated fear of unfairness and the notion that women are untouchable, and even when I’m completely right, I will not be supported. So, recently, now that I’m an adult, I tried to write about my childhood abuse by my sexist mother on different subreddits. For context, she abused me severely daily, physically, psychologically, and once when I was six, she even threatened to cut my throat with a knife while holding it. I just needed support from people, and guess what… A lot of women not only did not support me, but they even wrote cruel comments. The moderators even deleted these comments and pinned their comment to warn others; the comments were so hostile. I couldn’t believe it… How is this promoting true equality if a woman gets all the support and a man, instead of support, gets more abuse and cruelty? Of course, it’s not.

You will be attacked even just for asking why sexism from females against males is more validated than male against female. Can you imagine what kind of toxicity today’s media promotes? True equality is when people support people regardless of sex, which is not happening today at all. They even actively attack men and completely belittle our experiences. Feminism is an organized movement; they have a lot of support and resources and they have a huge responsibility, but unfortunately, today’s feminism is sexism against males",comment,MensRights,feminism,Men’s Opinions on Feminism?
1g2gx23,"

>1 - Do you believe if yours views on men’s rights were achieved, women and men would be happier?

No, just that some of the inequities have been 'adjusted' and we would be on the path to an egalitarian future.  Right now there is a very apparent clash between womens success in education/career that is clashing with base relationships/dating/marriage desires, where expectations and desires are not matching with the new reality, so women are getting unhappy and men are checking out, this is not going to bade will for western society.

>2 - Do you believe in feminism, and do you understand the different “types” of feminism?

As an ideal, sure, but as an (political) ideology no.  All for 1st and 2nd wave feminism, but things get squirrely with 3rd wave and on (female superiority)

>3 - Do you feel immediately on edge when a girl posts/replies to your comments?

No, I welcome the perspective, as long as in good faith

>4 - What would you say your “biggest” issue is in regards to your rights?

Inequities in treatment of male victims of domestic violence, psychological support, and divorce/family courts

>5 - Is there men’s rights if no feminism?

Feminism now is exclusionary to mens rights, with feminists telling men to deal with their own shit, but then getting upset when you do.  If feminism states it is also for equality of men, don't say that dismantling the patriarchy will fix it, no, it requires recognition that each sex is unique and we must work together.  Feminism now has little relevence, there needs to be an egalitarian change",comment,MensRights,feminism,Men’s Opinions on Feminism?
1g2gx23,"One of the founding mothers of American feminism took a dim view of men (from the Brave browser’s AI function):

*Women’s Superiority Views*

*According to Elizabeth Cady Stanton’s writings and quotes, she believed that women are superior to men in certain aspects. Specifically, she argued that women’s motherhood and nurturing roles grant them unique wisdom and power that men cannot possess.*


[In her diary entry of December 27, 1890, Stanton wrote:](https://books.google.com/books?id=CIsEAAAAYAAJ&pg=PA270&dq=%22We+are,+as+a+sex,+infinitely+superior+to+men.%22+--&client=firefox-a#v=onepage&q=%22We%20are%2C%20as%20a%20sex%2C%20infinitely%20superior%20to%20men.%22%20--&f=false)


**We are, as a sex, infinitely superior to men,** *and if we were free and developed, healthy in body and mind, as we should be under natural conditions, our motherhood would be our glory. That function gives women such wisdom and power as no male can possess.”*

That belief has run through feminism right up to the present day. I can’t support a system of belief in which I’m treated as an inferior person.

I’ll say this for old Lizzie, though: she didn’t pull her punches. Check out the end of this little passage:

*When women can support themselves, have their entry to all the trades and professions, with a house of their own over their heads and their own bank account, they will own their bodies and be* **dictators in the social realm.**

She was prescient on that last point. Women control every cultural institution in Western society, and they do not like to share power.",comment,MensRights,feminism,Men’s Opinions on Feminism?
1g2gx23,"Feminism is a women's supremacist movement fuelled by blatant misandry. It has nothing to do with equality. May be I'm wrong, but for me, one can't really be an egalitarian if that individual is a feminist.",comment,MensRights,feminism,Men’s Opinions on Feminism?
1g2gx23,"I think that feminism is anti-male and misandrist. I'm as anti feminist as one can get. The biggest issue is boys and men being falsely accused and women getting off scot-free for sex crimes. Another issue is women getting away with domestic violence and being allowed to take everything from men after marriage, thanks to alimony. 

Thanks to ""rape culture,"" there's a feminist witch hunt going on falsely accusing boys of men of being rapists or potential rapists. Most feminists are nasty people who love to project and accuse men of being ""privileged"" when men have always been disposable by society. 

We've got many misandrist feminist conspiracy theories floating around like ""male privilege,"" ""rape culture,"" ""patriarchy,"" and ""toxic masculinity"" in the wake of radical movements like Me Too that are vilifying boys and men. I think that feminism is too far gone and too radical today.",comment,MensRights,feminism,Men’s Opinions on Feminism?
1g2gx23,"> 1 - Do you believe if yours views on men’s rights were achieved, women and men would be happier?

Egalitarian men and women would be happier, others probably wouldn't.

>2 - Do you believe in feminism, and do you understand the different “types” of feminism?

I am sure feminism exists, there is no need to ""believe"" in it. The types of feminism I understand are: 

1. Radical, they openly say they hate men and act accordingly. 
2. Regular, they say they don't hate men but act like they do. 
3. Real, they say they care about men *(upd: and they really do)*, but there is no evidence they actually exist.

>3 - Do you feel immediately on edge when a girl posts/replies to your comments? 

I don't even know if it's a girl.

>4 - What would you say your “biggest” issue is in regards to your rights? 

Male genital mutilation.

>5 - Is there men’s rights if no feminism? 

Not sure what you mean.",comment,MensRights,feminism,Men’s Opinions on Feminism?
1g2gx23,"Why don’t you do your research into feminism and you’ll find out they are one of the main contributors to our problems. 

If you are a genuine egalitarian, you will not call yourself a feminist. Do you research.",comment,MensRights,feminism,Men’s Opinions on Feminism?
1g2gx23,"3- Hell no, we like that all people can comment.

5- There can't be men's right if feminism is allowed to exists : 

[https://www.youtube.com/watch?v=ISYBgqPKR2w](https://www.youtube.com/watch?v=ISYBgqPKR2w)

[https://www.youtube.com/watch?v=QRuLJnxL2lA](https://www.youtube.com/watch?v=QRuLJnxL2lA)

[https://www.youtube.com/watch?v=1EgF-Jp7Hz0](https://www.youtube.com/watch?v=1EgF-Jp7Hz0)",comment,MensRights,feminism,Men’s Opinions on Feminism?
1g2gx23,"1. Not all men and women would be happier if true gender equality was achieved, but the ones who believe in true gender equality would definitely be happier.

2. Not sure what exactly you mean by ""believe in"" feminism, but what I believe isn't really relevant anyway. Facts matter more. Feminism exists, and that is a fact. It does not fight for true gender equality, and that is also a fact. I'm also aware of the existence of different ""types"" of it, but they are of little consequence. None of them fight for true gender equality, and if there was a hypothetical type that did do that, it will never wield any meaningful power or influence over the movement.

3. No.

4. Lack of equal protection for boys and men. From violence, from genital mutilation, from conscription, from rape, from everything. In every single Western country, women and girls are given far more protection from bad things than boys and men.

5. Also kind of an unclear question. Are you asking what would happen if feminism disappeared tomorrow? Because I'm not sure, truthfully. It's become so deeply ingrained in Western society that imagining a world without it is extremely difficult.",comment,MensRights,feminism,Men’s Opinions on Feminism?
1g2gx23,"1. Men would, many women would - feminists who want favouritism and for society to indulge their bizarre theories would not. Although perhaps they could get the help they needed.

2. I don’t believe in feminism at all. I believe in some women’s rights which have long since been achieved (in the west strictly speaking, obviously there’s a lot of shitholes in the world which treat women like crap, not just in terms of opportunities, but also how they’re treated even within traditional gender roles).

The reason I don’t believe in feminism is that since the various times women have achieved equality in many areas, what we have seen from feminists in the years and decades since is that they only push for more advantage for women in these areas and are incapable of stopping, coming up with ever more demented theories as to why they need to act like this. What this tells me is women of the feminist inclination are simply inclined to demand special treatment and favouritism whether they’re behind, equal or in front - and can’t change that.

Perhaps there was a time when men and women could have gone into the future as equals, but that proved to be a pipe dream, because feminists showed they were utterly incapable of that and are only operating under the instinct to constantly demand more for themselves (something which wasn’t apparent when they actually had less in some areas). You can see this in the education system, and laws surrounding family law and sex crimes.

3. No. 

4. For me personally what pisses me off about feminism is the idea that whatever success men make they owe it (or half of it) to women. Men make company - feminists say women deserve half the board spots and control. Men make sports league - feminists say it must fund an attached sister league. It’s basically gold digging for the modern age, just attaching to mens success and being provided for by it. Except at least the old gold diggers gave something back men wanted - with feminists it’s more of a shotgun marriage men don’t want to enter into and has no benefit for them.

5. Not in the same way no. Although I don’t think of myself as for “men’s rights” - just for specific things some of which relate to men. That all encompassing academic/quasi religious gender based world view is more of a feminist thing.",comment,MensRights,feminism,Men’s Opinions on Feminism?
1g2gx23,"1 - yes.  As feminism has taken over women have got unhappier https://law.yale.edu/sites/default/files/documents/pdf/Intellectual_Life/Stevenson_ParadoxDecliningFemaleHappiness_Dec08.pdf

2 - No.  No.

3 - No, wtf would anyone??

4 - a) women carry no responsibility for defending the country (ie the draft) yet have equal say in who our leaders are that will send us to war. b) men have no say in abortion.   Both parents should have equal say, no abortion without both parents consent.  So in both of these issues there is inequality but you never hear feminists raise it.  

5 - No.",comment,MensRights,feminism,Men’s Opinions on Feminism?
1g2gx23,"

Most of us want EQUALITY of the sexes. Gender neutral laws, public policies, opportunities, etc. If you want to learn why we are against feminists read my comments in this thread. It starts off with rape and DV statistics manipulation and blocking equal laws.

https://old.reddit.com/r/MensRights/comments/130eya7/what_problems_bring_out_the_need_for_a_mens/

Or read this list about feminism misandry for anyone who thinks that feminism fights for men’s rights, for anyone who thinks that feminism was only a sexist movement starting from the third wave and for anyone who accuse the MRM of being a sexist movement, while still defending feminism.

https://www.reddit.com/r/MensRights/comments/9v6tqj/a_list_about_feminism_misandry_for_anyone_who/

IMO, anti-feminism isn't sexist against women. It is anti-sexist.

I suggest you educate feminists on the dictionary definition of feminism and we wouldn't have a problem with them. If the influential feminist researchers, professors, lobbyists, public policy makers, journalists, authors, politicians, and protesters (and the ""real feminists"" using their work rather than calling out their sexism, bias, bigotry, data manipulation, outright lies, etc) were to follow the dictionary definition of feminism rather than the man hating spirit of feminism, I wouldn't be at odds with them. I would be a feminist. Unfortunately, the ones with a voice hate men and the rest keep quiet and don't call them out on it...",comment,MensRights,feminism,Men’s Opinions on Feminism?
