parent_post_id,text,source,subreddit,keyword,post_title
1f70bd7,"Every Abrahamic religion doctrinally believes women to be inferior and property. Feminism wasn’t never written into these religions. 

It’s made by men, for men.",comment,Feminism,feminist,you can’t be a feminist and be supportive of islam.
1f70bd7,"I just can’t get why people are reluctant to say that. I mean here in the Islamic world, you’re life might be in danger so it makes sense to choose your words wisely but people who live in western secular states and get all the benefits of secularism still support Islam for some reason?",comment,Feminism,feminist,you can’t be a feminist and be supportive of islam.
1f70bd7,"Any organization that affects everyone, but only allows a privileged demographic to have power with no real oversight, is a bigoted organization. 

Very, very few religions don't  fit this description.",comment,Feminism,feminist,you can’t be a feminist and be supportive of islam.
1f70bd7,"If a religion is patriarchal, you can't be feminist and support it. Feminism is about tearing down the patriarchy. If a religion is built on patriarchy, feminism can't support it. The religion can adapt and tear down its own patriarchal foundations, but few sects have.",comment,Feminism,feminist,you can’t be a feminist and be supportive of islam.
1f70bd7,"So is Christianity and any other religion or ideology that has emerged in a patriarchal society. The problem is not religious freedom or the dogmas of a faith, the problem is patriarchy and how those dogmas influence it.

Religions are ideas that evolve over time. No religion is the same as it was 200 years ago. Neither is Islam.

The idea is not to embrace Islam as a perfect thing, but to accept the diversity of ideas while criticizing misogynistic dogmas and demanding its adaptation to an egalitarian society.

But come on, it is not a coincidence that we see misogyny in Islam and find it difficult to see it in Christianity or other ""white"" religions. And that is something that must be taken into account when talking about it. That and the hatred towards Islam that many promote out of pure racism and try to disguise as social justice. Is it important to attack sexist dogmas? Of course, but without falling into reductionism or trying to clean up the neighbor's house and ignoring the shit in our own.",comment,Feminism,feminist,you can’t be a feminist and be supportive of islam.
1f70bd7,"its my personal belief that anyone actively participating in religion is in some ways preventing equality from being achieved since all religions prescribe oppression of some group ,including but not limited to women",comment,Feminism,feminist,you can’t be a feminist and be supportive of islam.
1f70bd7,I don't think any of the Abraham religions are compatible with feminism,comment,Feminism,feminist,you can’t be a feminist and be supportive of islam.
1f70bd7,I don’t believe in any organized religion having a net benefit for women’s equality and I understand less people bringing up religions in these comments that believe that your being a woman is a cosmic punishment that prevents you from achieving enlightenment in this lifetime. Just because something is an Eastern religion doesn’t make it any less sexist…,comment,Feminism,feminist,you can’t be a feminist and be supportive of islam.
1f70bd7,"Thank you! Coming from a country where Islam is the major religion, I am TIRED of people calling themselves feminists defending Islam.",comment,Feminism,feminist,you can’t be a feminist and be supportive of islam.
1f70bd7,Working for reform within all of the patriarchal religious traditions is an important part of feminism.,comment,Feminism,feminist,you can’t be a feminist and be supportive of islam.
1f70bd7,"There are three Abrahamic religions, all of which have elements of oppression of women. Just because two of them have (in some cases/locations) put aside a few of the worst parts doesn't make them better. They're all equally bad because they're all derived from the same source. 

Even non-Abrahamic religions are products of their societal origins, which includes patriarchal oppression. 

Organized religions in general are about pitting the in-group against the outgroup. People want to feel like they're better than other people and religion fosters that.

Obviously this is my opinion, I like to criticize all religions equally because I think they're all bad, for women especially.",comment,Feminism,feminist,you can’t be a feminist and be supportive of islam.
1f70bd7,"I agree. You can support Muslim women’s liberation but that requires them no longer following Islam, which would make them not Muslim",comment,Feminism,feminist,you can’t be a feminist and be supportive of islam.
1f70bd7,"If anyone knows of a not-misogynist church that I could join, please share the denomination.",comment,Feminism,feminist,you can’t be a feminist and be supportive of islam.
1ksvdkk,"It's always the same...

She hates herself. For her lifechoices, for showing her body to everyone for the attention, for her choices of men who maybe hurt her. The attention and short moments of power when she can manipulate a man with her sexuality is all she got. And this fades away with age.

She projects her selfhate on men in general. But deep down, she know. They all know...",comment,MensRights,feminist,Confessions of a feminist
1ksvdkk,">a ""true man"" is a man who passively endures everything without saying a word or shedding a single tear: his only purpose in the World is to be a tireless and silent provider who must satisfy, endlessly, all the whims of the ""female goddesses"".

It's the same ugly attitude as saying a ""real woman"" spends her time barefoot, pregnant, and in the kitchen.",comment,MensRights,feminist,Confessions of a feminist
1ksvdkk,"Ironic how this ""goddess"" and ""superior female being"" sales her body online (most likely even not earning that much) for the entertainment of the bottom of the barrel men.",comment,MensRights,feminist,Confessions of a feminist
1ksvdkk,"Sounds like she developed a brain disorder (bipolar, schizoaffective etc.)

Or shes been corrupted by feminism. 

Remember its not men who have been radicalised to the right, its womrn who have leap frogged to the ultra left.

I can see the anti maleness in white women very obviously now, worsen since 2010 when the worst started imo.

Universities and schools seem to be the upstream of this feminist poison.",comment,MensRights,feminist,Confessions of a feminist
1ksvdkk,"i saw a picture one day it says:

""remove sexual-desire interaction from women and you will find how boring they are""",comment,MensRights,feminist,Confessions of a feminist
1ksvdkk,"Lol, and this is a future post wall cat lady! Imagine giving a crap about what she has to say!",comment,MensRights,feminist,Confessions of a feminist
1kvrqwj,"https://www.teenvogue.com/story/why-bisexual-women-are-at-a-higher-risk-for-violence

This article sums up a lot of what I want to say on the matter, even if it’s a few years old.

Bisexual women are at much higher risk of domestic violence than lesbian women, but also approximately twice as at risk as heterosexual women!

We’re not winning some special privileges for being bisexual in the “who suffers the most” Olympics and our experiences and identities are frequently erased and de-centred even in a conversation like this one which is explicitly about our identity and experiences.

We’re valid too. Hiding who we are may keep us safe in certain specific situations, but it’s not good for anyone to have to hide important parts of themselves in order to not face discrimination, prejudice, and/or violence!

OP, I hope that you can take a deep breath and hear me when I say that it’s okay to be bisexual. Other orientations do not make people better or more valuable or even more queer (even a heterosexual person might be trans or poly or non-conforming in other queer ways)

The world can be a harsh place at times, but choosing partners in a way that’s not strictly dependant on the contents of their undergarments doesn’t seem like that big of a deal to me! We’re just people trying to go about our lives, the same as anyone else.",comment,Feminism,feminist,Bisexual women benefitting from patriarchy and harming lesbians
1kvrqwj,"""I even saw a TikTok where"" no **this was your problem** don't ever do this. Everything you see on TikTok is one kind of a scam or another. You have been caught in the scam where people say inflammatory things to get your attention and get you talking about what they said. You being the way you are isn't ""harmful to lesbians"", your attraction to women isn't ""impure"", you are being made anxious to drive someone else's social media career.",comment,Feminism,feminist,Bisexual women benefitting from patriarchy and harming lesbians
1kvrqwj,being attracted to men doesn’t make bi women’s attraction to women impure. this is a very problematic mindset. it insinuates that bi women are tainted by their attraction to men.,comment,Feminism,feminist,Bisexual women benefitting from patriarchy and harming lesbians
1kvrqwj,"It is technically true that bi people (in this case bi women specifically) can avoid 'outing' themselves by having a partner that makes the relationship seem outwardly hetero. That hardly makes bisexual women harmful to lesbians.


Why should lesbian women have the main voice? You're attraction to men doesn't make it less pure. That's just biphobic. People might trust you less but that's not because you're less trustworthy.",comment,Feminism,feminist,Bisexual women benefitting from patriarchy and harming lesbians
1kvrqwj,"if we are in a relationship with a woman, we and lesbians have the same chances of suffering homophobia. if we are in a relationship with a man, we and straight women have the same chances of suffering violence. how would bi women benefit from anything when our sexuality is invisible in both ways and we are blamed for every violence that happens against us? this is just biphobia.

edit: also we are always seem as ""a bi woman in a relationship with a [woman/man]"", not to mention we cannot be considered just as a woman living her sexuality and her life",comment,Feminism,feminist,Bisexual women benefitting from patriarchy and harming lesbians
1kvrqwj,"I'm confused by the phrase """"our attraction to women isn't as pure""""

Does anyone actually think this? It's a VERY strange way to phrase that and let's be aware that HAL types are trying to infiltrate political subs",comment,Feminism,feminist,Bisexual women benefitting from patriarchy and harming lesbians
1kvrqwj,"“Our attraction to women is less pure”? 

Sweetie, sexuality isn’t a rock. You can’t break it down into its chemical components and find the percentage of whatever elements are in it. Down this way lies madness. What’s next? We de-prioritize the voice of any lesbian who can recognize hotness of any given man? We de-prioritize the voice of any lesbian who has ever held hands or hugged a man? For what? Where does this leave nonbinary AFAB folk who date women, where does this leave trans women who date women?

It’s just biphobia, and the queer community isn’t immune from displaying it or weaponizing it. If we start breaking apart the coalition by playing purity politics, we are never going to have a sufficiently strong voting bloc to defend ourselves in a democratic system and we are never going to have robust enough communities to support us when shit hits the fan. 

Queerness is about building. Let the only things we break be fascism and patriarchy.",comment,Feminism,feminist,Bisexual women benefitting from patriarchy and harming lesbians
1kvrqwj,"As a lesbian, bi women are not harmful to us for existing at all. Some bi women can unfortunately uphold cisheteropatriarchy and align with male supremacy against other queer women, but those involve specific actions/beliefs that they choose to uphold. For example, bi women 100% belong in queer spaces. However, the ones who insist on bringing straight male partners to sapphic focused events, or worse, unicorn hunting there, are making that space less safe for others. It's not the attraction to men that makes anyone dangerous, it's the centering/catering to them that does. ",comment,Feminism,feminist,Bisexual women benefitting from patriarchy and harming lesbians
1kvrqwj,">I don’t want to center myself too much because ultimately lesbians are the ones who should have the main voices in queer settings, rather than bi women, especially since our attraction to women isn’t as pure since we are also attracted to mn

This is a completely wrong idea. Queer is a very broad label, and not exclusive to only one group such as lesbians. What you have posted here sounds like a biphobic notion that you might have heard from someone.",comment,Feminism,feminist,Bisexual women benefitting from patriarchy and harming lesbians
1kvrqwj,"Firstly, you are on the wrong side of the internet and I’d suggest getting out of whatever spaces you keep seeing those. The vast majority of lesbians do not hold those opinions about bi women

As for your post, bisexual women are not inherently harmful to lesbians. They do not benefit from patriarchy any more than straight women - in fact they have some documented disadvantages due to patriarchy that straight women do not have. The nuance about bisexual women that others have already pointed out is that bisexual women can be in straight relationships and avoid many of the negative effects that come with being lgbt. This isn’t necessarily “benefitting from patriarchy” a bisexual women are still women after all. But it does allow those bisexual women to avoid the unique challenges that most lesbians face. But this is not inherently harmful to lesbians. And lesbians (generally speaking) agree with this",comment,Feminism,feminist,Bisexual women benefitting from patriarchy and harming lesbians
1kvrqwj,"I’m a bisexual woman and I choose to only seriously date men as a survival mechanism. My family would never accept a female partner and I wouldn’t want to put a hypothetical female partner through that hell. I get I’m in a privileged position where I can make that choice. Not nearly as difficult being a bi woman than it is being a lesbian. But it’s still a part of my identity, especially when I came out to my family and they told me to “never say that shit again” 🤗 don’t mind if I do!",comment,Feminism,feminist,Bisexual women benefitting from patriarchy and harming lesbians
1kvrqwj,"As a queer woman who identified as lesbian for years and now identifies as bi, when I hear ""gold star lesbian"" or ""queer radical feminist"" I hear ""TERF"" so I don't take claims from those women seriously. HUGE Venn overlap, so fuck them.

(TO BE CLEAR: I don't think lesbians who have only been with women are TERFs, even if all those women happen to be cis. I think people who use the *term* ""gold star lesbian"" very often are.)

""ultimately lesbians are the ones who should have the main voices in queer settings""

Uhhh...why? Maybe have a look at your own internalised biphobia, friend.",comment,Feminism,feminist,Bisexual women benefitting from patriarchy and harming lesbians
1kvrqwj,"The answer after many years of research and study is simple; 

Exclusionist feminists are actual trash and their opinions mean less than nothing",comment,Feminism,feminist,Bisexual women benefitting from patriarchy and harming lesbians
1kvrqwj,"As a lesbian lemme shut this down real quick.
Bisexuality is a valid identity and is not less ""pure"" than being a lesbian.
To my knowledge the only queer people that benefit from the patriarchy are masc presenting men and femme presenting women.
Lastly, which ever self hating or insecure person decided that being bisexual was a ""curse"" is WRONG.
Bisexuality is not impure and yall are sure as hell not erasing the lesbian identity.",comment,Feminism,feminist,Bisexual women benefitting from patriarchy and harming lesbians
1kvrqwj,I was literally talking to my girlfriend about this yesterday. She's bi and the bi haye is so real. Hetero sexual people see her as a walking threesome and gay people view her as faking and pretending to claim lgbtq status for clout. I think to a lot of people who view attraction as black and white have their brains broken by people who can be attracted all genders. And since she is dating me (a cismale) people in the lgbtq community see her as lying for clout despite her previous relationships.,comment,Feminism,feminist,Bisexual women benefitting from patriarchy and harming lesbians
1kvrqwj,Bi women can often be male centered and I've experienced a lot of lesbophobia from bi women. However this isn't inherent to bi women.,comment,Feminism,feminist,Bisexual women benefitting from patriarchy and harming lesbians
1kvrqwj,"Bisexual women belong in the queer community just as much as lesbians, gays, pans, trans, aces, agender/genderfluid.

It is just blatant biphobia, bis and aces constantly cop it from other queers constantly.",comment,Feminism,feminist,Bisexual women benefitting from patriarchy and harming lesbians
1kvrqwj,I mean if you're bi in a lesbian relationship idk how you could benefit from patriarchy....,comment,Feminism,feminist,Bisexual women benefitting from patriarchy and harming lesbians
1kvrqwj,"I think this is a conversation that is way too nuanced for most internet posters to handle, tbh. There are a lot of bad/badly said takes out there.

There are a couple important things to remember:

1. The majority of LGBT-identified people are bisexual, and the majority of those are women. There are a LOT of bi women out there, and they are not a monolith. There are vastly different experiences within that group, and almost no generalization is going to apply to everyone.

2. Identity ≠ community. Community is built based on shared experiences - in the case of the LGBT community, we’re talking about the shared experience of living a life that goes against the grain of heteronormativity and dealing with the homophobia/transphobia resulting from that.

3. There are a lot of bisexual women out there who are long time, trusted, deeply ingrained members of their local LGBT communities. Who are living lives that are not any different from the lives of their lesbian neighbors in any meaningful way.

4. There are also a lot of bisexual women out there who are not part of the LGBT community. They live straight lives in the straight world, benefit (as much as a woman can) from straightness, and don’t have much in common with their gay and bi counterparts at all.

5. By nature of having the option to pick between participating in the straight and gay worlds, or even dabbling in both, bisexual women have a different experience of queerness than lesbians do.

5. All women can function as tools of the patriarchy. Straight, bi, lesbian, everyone. Often, it stings a little more when that type of behavior comes from someone who is closer to you, so bisexual women may often be held to higher standards than straight women are. 


So, to address your question: does attraction to men and women make you less trustworthy in queer spaces? Ultimately, at least if you’re just beginning to establish your reputation, yes. 

Despite the huge amounts of unproblematic bisexuals out there, enough people in the queer community (both gay and bi) have had bad experiences with straight-aligned bisexuals treating our community with entitlement and disrespect, that it might take them getting to know you a little more before they really trust you. But don’t worry! If you’re a trustworthy community member, you’ll be accepted before you know it. And pretty soon you’ll be swapping horror stories with everyone else about your own experiences being personally victimized by a bisexual woman lol.",comment,Feminism,feminist,Bisexual women benefitting from patriarchy and harming lesbians
1kvrqwj,"“Isn’t as pure”? Oh hell no. As someone who is maybe-sort-of a lesbian myself (still questioning, but I’m definitely not into men), I urge you to get out of whatever spaces that you’re in that are telling you your bisexuality is “less pure”, because those are not queer positive spaces. Why are you wasting your time around so-called feminists who treat your sexuality as something to be ashamed of? Women’s sexuality, and especially queer women’s sexuality, is already so horribly stigmatized due to the patriarchy. Don’t put up with that shit from people who pretend to be on your side. Your attraction to men is as pure as your attraction to women and vice versa. 

Also, I wouldn’t recommend taking anyone who calls themselves a “gold star” lesbian too seriously when it comes to this sort of thing. Any lesbian who thinks herself a better lesbian than those who have had to have relationships with men for their own safety, who have survived sexual assault by men, or who have struggled more with compulsory heterosexuality (and dated/had sex with men as a consequence) should do some serious self reflection.",comment,Feminism,feminist,Bisexual women benefitting from patriarchy and harming lesbians
1kvrqwj,"as a fellow bi woman I do think there's a lot of biphobia around, although I've heard it just as much in the hetero community as among lesbians and gays. however, I do think there's something to be said for it depending on the lifestyle and the choices you make.

I'm in a long term relationship with a man. when we step out of the door every day, holding hands, we are almost zero % likely to face any prejudice or even stares (we are both white and live in a Western country). if we were to get married, there would be few obstacles or raised eyebrows even in the most rural areas of the country. the worst a bigoted family member would give us pressure about kids etc.  or the odd comment if they knew I was bi. - at the end of the day people tend to judge on your lifestyle rather than identity.

This is not the same life as an out-lesbian couple. All of those experiences will be different for them, likely more challenging, and the experience of facing this every day is a different life because of who they are with, how they might present etc. They can't choose to participate in a hetero-normative lifestyle , without completely repressing who they are. They might have to avoid certain family members , certain activities, and certain spaces.

I don't think it's accurate to describe the discrimination faced, as the same depending on your situation - the only time I've faced homophobia was when I was literally \*with\* a woman, holding her hand out in the park, and a preacher got angry with us. as far as the homophobes are concerned, it wasn't relevant whether I was bisexual in that moment.

I remember some lesbian friends of mine describing a female queer event recently where literally all the girls were just talking about their boyfriends. Granted, nothing inherently wrong with that and these bi or NB women have the right to be there unless otherwise stated, but it doesn't exactly speak to the queer experience and if you're lesbians needing a certain space, that would mean specifically needing to create spaces for lesbians. I didn't judge them at all for feeling a little bit surprised and left out of that gathering.

  
P.s 'gold star lesbian' is a gross term, I've rarely heard it used",comment,Feminism,feminist,Bisexual women benefitting from patriarchy and harming lesbians
1kvrqwj,"I don't believe stupid and mean things said on TikTok, and sometimes, people post them, which junks up Reddit. 

I am fine with bisexual feminists, I am not a radical feminist, and I couldn't tell you their attitude because I don't know any besides famous ones in history.",comment,Feminism,feminist,Bisexual women benefitting from patriarchy and harming lesbians
