parent_post_id,text,source,subreddit,keyword,post_title
1hkq2q5,"There is absolutely an intersection between veganism and feminism! Actually, seeing an image a woman in place of a cow in one of those milking units is what radicalized me to change my diet. Now vegan, 10+ years. To boil it down tldr, I’d say the link is bodily autonomy. Sorry I don’t have the capacity to get super deep into it, but thank you for bringing this up!",comment,Feminism,feminism,Feminism and veganism interconnection 
1hkq2q5,"Veganism doesnt end animal oppression, just like not dating a man  doesnt end the patriarchy. We need to overthrow the capitalist system that tortures animals and humans for profit. We need to destroy the patriarchal system that thinks men matter more. Personal action achieves nothing but vanity.",comment,Feminism,feminism,Feminism and veganism interconnection 
1hkq2q5,"As a feminist who grew up and works on a beef farm, most definitely not for me. I do not equate women to livestock.",comment,Feminism,feminism,Feminism and veganism interconnection 
1hkq2q5,"Feminism is about equality and equity for women in a society dominated by toxic masculinity, and is ultimately about the equality and equity of *everyone* since toxic masculinity *harms everyone*. But it’s about *people* in *our society*, not other animals. But ALSO…: yea, we are animals? That’s just a fact, sorry to burst your bubble. We’re a specific kind of animal with a unique intelligence level, society, and a uniquely dominant level of power over the rest of the planet which means we have a responsibility for how we interact with the rest of the planet, but we are, in fact, animals, at our core. These kinds of vegans make me so frustrated. Shoehorning veganism into every other cause doesn’t make more people turned on to veganism, it just turns people off to those other causes. It’s perfectly fine to be a vegan and it’s perfectly fine to have feelings about the ethics of eating meat or other animals products, but it’s this obnoxious and pretentious obsession with forcing veganism into every conversation so they can browbeat people for not being perfect across every conceivable metric that makes people hate them",comment,Feminism,feminism,Feminism and veganism interconnection 
1hkq2q5,I guess i’m just against oppression and exploitation across the board in all areas.  And I don’t want to gatekeep compassion if we don’t have to.,comment,Feminism,feminism,Feminism and veganism interconnection 
1hkq2q5,"Nope

Women are under enough pressure and guilt already, and also interconnecting these things doesn't do any good for any of them",comment,Feminism,feminism,Feminism and veganism interconnection 
1hkq2q5,"I agree with the picture! misogyny and our oppression of animals are both rooted in the belief of a stronger “species” that they are superior, and thereby entitled to use violence, force, and intimidation to force a less strong group to give them what they want.",comment,Feminism,feminism,Feminism and veganism interconnection 
1hkq2q5,Comparing women to farm animals makes me cringe.  This is such a stupid take.  Reddit vegans are not ok,comment,Feminism,feminism,Feminism and veganism interconnection 
1hkq2q5,"So the infanticide of every newly hatched male chick in the egg industry is a men's rights issue? 

I get that caring about animal welfare and animal rights has its place but to make it into a feminist issue seems entirely insane.",comment,Feminism,feminism,Feminism and veganism interconnection 
1hkq2q5,"The amount of privilege in some of these comments is astounding.  I have extreme allergies.  Extreme.  All grains besides oats.  I am allergic to corn, rice, soy, beans, peas every veg besides asparagus and broccoli. I am also allergic to eggs and pork.  If I couldn't have dairy and beef or chicken I would die pretty much.  I guess you are OK with me dying?  Sounds like it. Fucking unbelievable.  ""Just admit you just want to eat burgers""?  Go fuck yourself seriously.  Live one day in my fucking life I dare you. (And since it's fun to list more allergies, citrus, melons, most nuts, banana (latex trigger) strawberry, avocado(latex again) ginger, turmeric, garlic, lettuces, and don't get me started on medicine allergies.",comment,Feminism,feminism,Feminism and veganism interconnection 
1hkq2q5,"If you choose to be a vegan , that is your choice. We can always keep moving towards more ethical practices when we produce food, but telling humans from varying backgrounds that your aren't a true feminist unless you are vegan is unhelpful at best and down right harmful to the movement at its worst. There will never be a completely vegan human population on earth due to the fact that it would actually be more harmful due to the ecological damage caused by shipping and that humans have a varying mirad of health issues that would stop some from being able to live as vegan.  You may not like the idea of eating meat and that is fine but you can not force it on everyone else. Humans are classified as omnivores for a reason. Heck eating meat is how we evolved to get such big brains in the first place. Feminism is about choices right?",comment,Feminism,feminism,Feminism and veganism interconnection 
1hkq2q5,"This started as a PETA thing, and PETA is a deeply misogynistic organization.

It doesn't have anything to do with feminism, PETA folks are just gross.",comment,Feminism,feminism,Feminism and veganism interconnection 
1hkq2q5,"I think it’s a good point. I don’t expect every feminist to be vegan (I’m not), but I think the point of the sticker is that if you are a feminist and care about the oppression of human females, you might be sympathetic to veganism on the basis of protecting other female animals. Not that the fights are or should be one and the same.",comment,Feminism,feminism,Feminism and veganism interconnection 
1hkq2q5,"Ooh boy am I so over women being compared to farm animals and property that gets stolen. 

This is not feminism.",comment,Feminism,feminism,Feminism and veganism interconnection 
1kqqncq,"That first example is dumb, like, legitimately pitiful.

""I'm going to do the exact thing I'm supposed to do, just in a different order that absolutely no one will notice or care about. To fight the pAtRiArChY!""",comment,MensRights,feminism,Microfeminism - feminism gets even sadder
1kqqncq,"*saying ""girls"" instead of ""guys"" as a gender-neutral term*

mental hospitals are too empty nowadays",comment,MensRights,feminism,Microfeminism - feminism gets even sadder
1kqqncq,"So basically, it's women acting as they always have? 

This is nothing new. Women have been reacting disproportionately to perceived slights since before I was born, and I'm an old guy now.

I honestly just wonder how with us supposedly living in The Handmaiden's Tale, women find the time and energy for this shit. That one femcel in the first link made a video, lying down on her side in bed, mumbling about how when she writes an email to multiple people, she puts the women's names first.

Who has time to think about that shit in day-to-day life? Is this why women are so unhappy now? Because they simply have too much free time, and their brains are misfiring from spending half their waking hours watching TikTok? Because they've been DEI'd into positions where they have no responsibilities and no accountability, and they can just fuck around on their phones all day?

Like, imagine living like that. Imagine treating every social interaction as an opportunity to win imaginary points against an imaginary opponent. Imagine having absolutely no capability for self-reflection because your entire worldview is ""I'm the victim.""",comment,MensRights,feminism,Microfeminism - feminism gets even sadder
1kqqncq,"Do they think that their petty little actions will, in some magical way, make the mythical beast they call the patriarchy real?",comment,MensRights,feminism,Microfeminism - feminism gets even sadder
1kqqncq,Being rude to men on purpose is micro feminism? Thank for clarifying,comment,MensRights,feminism,Microfeminism - feminism gets even sadder
1kqqncq,"So they think this would bother guys, most of which have already started ""ignoring their antics and going their own way""?",comment,MensRights,feminism,Microfeminism - feminism gets even sadder
1kqqncq,So what little micropatriarchy can we do to counter this?,comment,MensRights,feminism,Microfeminism - feminism gets even sadder
1kqqncq,"So, microfeminism is intentional microaggressions against men? Got it.",comment,MensRights,feminism,Microfeminism - feminism gets even sadder
1kqqncq,"These are bids for interaction and engagement from men, nothing more. Even lesbians are fixated on getting male attention. All attention, good or bad, is what they want b/c they are empty ciphers. Sad but true. 

They should be working on their mental issues, but instead prefer to have neurotic interactions that further erode their self-esteem since most of them never accomplish anything of merit and just want endless approval, especially from men. 

Getting a job, working, a degree: These are mostly worthless pursuits and always have been. Making things, doing the Work to improve, meeting personal goals unrelated to career are things of value. Family. What others think and the daily grind are nothing special. Dudes generally grok this; women, not so much. 

They are still in competition mode with everyone and don't get why they feel so bad about themselves. Dudes want things, too, but are frustrated in their efforts by the see-me-roar feminist types (who usually go after morons to control or who trigger their latent emotional instability). So they are moving along.

Meanwhile, most women are stuck in this low-level Maslow psychodrama and are too fragile to hear outside counsel. They really should step back, look at their behavior, and deal with their anger, which is mostly aimed at themselves and uses the father as an imprint (and early, failed relationships with guys) to lash out over. 

Women aren't perfect and must be reminded of that (and that it's OK not to be). Perfection is an illusion and an attachment to outcome. Let it go. Just be and treat others well. If they cross you, ruthlessly weed them out of your life and move on. Treat each individual as a discrete unit. 

Let go of blame/shame/guilt baggage. It does nothing for you, and always works against you. But most women don't get this and lean on other damaged women instead of looking within themselves, which scares them. It's all there, at any time or place, if you are open to it, all within you.",comment,MensRights,feminism,Microfeminism - feminism gets even sadder
1kqqncq,"The main grievance I have is how privileged they are in dating, how shit it is for men, and then still have to listen to them bitch about this delusion of patriarchal oppression",comment,MensRights,feminism,Microfeminism - feminism gets even sadder
1kqqncq,"Don’t they realise this just turns more men against feminism? This is how you lose a battle. If you can’t treat men with respect, they won’t respect you.",comment,MensRights,feminism,Microfeminism - feminism gets even sadder
1kqqncq,"lol how pathetic. I thought that they wanted to be treated as equals deserving of respect. Good luck getting that after acting like a petulant child. 

Best case for them, no one notices their childish behavior. Worst case they get themselves fired, knocked on their ass when they refuse to move out of the way, or are ostracized for being cringey children. Either way it’s no benefit to them or their cause. And will just lead to more of them being written off. They would realize this if they weren’t so mind bogglingly stupid.",comment,MensRights,feminism,Microfeminism - feminism gets even sadder
1kqqncq,"Go, you girl!

Just funking go.

As far away as possible.",comment,MensRights,feminism,Microfeminism - feminism gets even sadder
1kqqncq,"I suggest we use the phrase ""Dear men and women"" from now on.",comment,MensRights,feminism,Microfeminism - feminism gets even sadder
1kqqncq,"Pointing out Mansplaining, manspreading, and tone policing were already enough...


Being completely disregarded for how you speak normally is already a sure sign you're wasting your time. Women's basic retort to men's points and expressions are typically whataboutisms that are designed to devalue your entire statements because some bogeyman exists, or, the system was created by your people so, it's your fault.


It feels like these are just invitations for an argument. Which will likely use the above tactics to appear as a victory. ",comment,MensRights,feminism,Microfeminism - feminism gets even sadder
1kqqncq,"Feminists themselves don't know what version of feminists they are. Let them scream into the void. They crave men's attention. Most of the posts and content are rage baits designed to make men act up. 

The types of feminists I understand are:

1. Radicals, they openly say they hate men and act accordingly. The ones who don't want equality with men but superiority over men. The ones who vehemently deny the existence of misandry. 

2. Regulars, they say they don't hate men but act like they do. They say they want equality with men but in reality they want the so-called men's privilege but without taking on men's burdens. Equality, indeed. The ones who say that they acknowledge the existence of misandry but still do misandrist activities and conversions as if they are doing nothing wrong. 

3. Real ones, they say they care about men (upd: and they really do), but there is no evidence they actually exist. They do not have any problems with inheriting both the men's privilege and men's burdens. No misandry at all.",comment,MensRights,feminism,Microfeminism - feminism gets even sadder
1kqqncq,I feel nothing but pity for these people. Is this all they have in life?,comment,MensRights,feminism,Microfeminism - feminism gets even sadder
1kqqncq,"Always make it obvious that you are taking notes of feminist microaggressions, with a view to sharing your documentation with HR.

Of course, you won't really, but it shits them up and shuts them up.",comment,MensRights,feminism,Microfeminism - feminism gets even sadder
1kqqncq,Are they also campaigning against lady first privileges?,comment,MensRights,feminism,Microfeminism - feminism gets even sadder
1kqqncq,"It’s OK. When the grocery cashier is female, I wait till she bags everything to my liking, before I pay.",comment,MensRights,feminism,Microfeminism - feminism gets even sadder
1kqqncq,"Perhaps the saddest part of this new strategy is that they think that this is rebellion, because they believe that someone using ""guys"" as a gender neutral term is a deliberate slight on women.

If there's one benefit here, it's that when they pull these moronic stunts and realize that they had absolutely zero impact whatsoever... perhaps they'll realize that they've finally arrived at the point where they're chasing the ghost of patriarchy long past.",comment,MensRights,feminism,Microfeminism - feminism gets even sadder
1kqqncq,"So basically creeps making life more miserable. 
Just destroying stuff without contributing anything meaningful. Living in an endless cycle of grievances without taking any personal responsibility.

Basically feminism. On a smaller more irritating scale.",comment,MensRights,feminism,Microfeminism - feminism gets even sadder
1kqqncq,"'New' word...same tiresome, vindictive behaviours, so nothing new in that regard from them.",comment,MensRights,feminism,Microfeminism - feminism gets even sadder
1kqqncq,This is just flat out desperation. It’s actually pathetic.,comment,MensRights,feminism,Microfeminism - feminism gets even sadder
1kqqncq,"So feminists are encouraging each other to micro-aggress towards men.

Maybe this is why so many young women keep stalking me in public spaces like grocery stores and physically forcing me to move out of the space I’m in by trying to collide with me.",comment,MensRights,feminism,Microfeminism - feminism gets even sadder
1kqqncq,"It seems to be making things more difficult for themselves and tying themselves into knots to try and make it feminist.

Um, who cares what order you are emailing someone?

Not moving over when a guy is moving faster, but you do it for women who are moving faster than you, is just petty and rude.

The term guys is not a slight against women, it's just a neutral term. 

Seems to be more about getting attention and making themselves feel better. If anyone even notices this.",comment,MensRights,feminism,Microfeminism - feminism gets even sadder
1kuxpwl,"It’s not a “wage gap” it’s a choice gap - it’s acceptable for a woman to choose career or other, for men, much less so. 

How many women for eg are forced to pay alimony/child support after a divorce?",comment,MensRights,feminism,Rights
1kuxpwl,"> **will a feminist woman marry and take care of him**??

Bro, that sentence violates the core principles of modern feminism. *Take care of him??* That’s blasphemy.",comment,MensRights,feminism,Rights
1kuxpwl,"Well, if she wants to. Why are you waiting for women to be okay with you wanting to be a househusband ? Just do it and you will maybe find a lady that likes that.",comment,MensRights,feminism,Rights
1kuxpwl,"Want? At what point did Feminism ever talk about men's opinion and their choice? There has never been a choice, because it's either A. blamed to the boogeyman that there isn't one, or B. It's put under the partnership category that you do exactly what she does, which in reality, she also doesn't conform to. 

You're biggest fall pit here is to listen to an ideology that was broken from the start. There is no universal contract that every man and woman holds onto. People just hold onto whatever benefits them the most. Feminist just make it a pity party and try to gain their access to everything from there.   
There are no rules. only players.",comment,MensRights,feminism,Rights
1kuxpwl,"I know people who became househusbands because their wives earned more, or just because they wanted it. Nothing stops you, just be clear about your desire with women!",comment,MensRights,feminism,Rights
1kuxpwl,"I think a feminist woman wants to marry and take care of a househusband, yes ? I thought that's exactly what was deemed bad about feminism ? Creating ""weak househusbands"" to go with the ""evil working feminists"" ? To me it always seemed feminism was hated because men don't want to be taken care of. It never occured to me that men thought the ""taking care"" part was a lie.",comment,MensRights,feminism,Rights
5vwquc,"and yelling..

please lets not forget how bad it is if the woman is constantly yelling too. ",comment,MensRights,feminist,"Girls if you hit, slap, belittle, kick, punch, choke, throw things at, or control your boyfriends, you are the abuser."
5vwquc,"I remember I once saw a crazy woman hit her bodybuilder boyfriend with her purse, and punch him in the face etc. He just took it, blocked some with the hands but did not fight back. Because he knew that if he would fight back he would be viewed as the abuser. ",comment,MensRights,feminist,"Girls if you hit, slap, belittle, kick, punch, choke, throw things at, or control your boyfriends, you are the abuser."
5vwquc,How do we have a world where anyone would see the need to write something so obvious? How do we teach girls so that they would think strength or empowerment means hurting men?,comment,MensRights,feminist,"Girls if you hit, slap, belittle, kick, punch, choke, throw things at, or control your boyfriends, you are the abuser."
5vwquc,"My father always took my mothers punches and kicks with a painful laugh. I really admire him for that, when she hits me I don't have it in me to smile or laugh it off. And what often hurts even more than the punch is how disappointed she looks when I wince in pain.
She stopped hitting us a few years ago and I'm thankful for that, but I still instinctively flinch often when she moves her hands to grab something suddenly. And she's hurt by that, that I'm afraid of her, and in turn that hurts me, because i love my mother despite her many flaws and I don't want her to feel guilty.

I don't know why I'm telling you guys this personal story, it's just that that text makes me think that it's ok to share this",comment,MensRights,feminist,"Girls if you hit, slap, belittle, kick, punch, choke, throw things at, or control your boyfriends, you are the abuser."
5vwquc,My wife does all of these things. I feel sorry for her boyfriend.,comment,MensRights,feminist,"Girls if you hit, slap, belittle, kick, punch, choke, throw things at, or control your boyfriends, you are the abuser."
5vwquc,"What may get lost in this message is that a woman is more likely to abuse a man socially.  I would emphasize the words ""belittle"" and ""control"" in the original message.  This is where women bully and abuse men in a relationship because they often have more power and the ability to manipulate in this realm.  

It is obvious when someone physically assaults someone else.  Controlling and abusing someone through superior social skills is far more pernicious and less likely to be seen as abusive by the abuser and others.",comment,MensRights,feminist,"Girls if you hit, slap, belittle, kick, punch, choke, throw things at, or control your boyfriends, you are the abuser."
5vwquc,The fact that this needs to be said is soul crushing ,comment,MensRights,feminist,"Girls if you hit, slap, belittle, kick, punch, choke, throw things at, or control your boyfriends, you are the abuser."
5vwquc,"""Never hit a lady. If she hits you though, she ain't no lady"" 

Edit: just as a preemptive note: ""never hit a gentleman, if he hits you, he's no gentleman"" ",comment,MensRights,feminist,"Girls if you hit, slap, belittle, kick, punch, choke, throw things at, or control your boyfriends, you are the abuser."
5vwquc,"I had an older girlfriend right out of high school. I thought I was a baller. She'd abuse me all the time and think it was hilarious, and when I would tell her to stop she would call me a pussy. It started with just punches to the arm and it slowly graduated to slaps in the face just for her amusement. 

One Sunday, we were laying around and she said 'hey, let's go to Best Buy so I can get a cd.' (I know, I'm old as fuck). And I told her no, I didn't feel like it because the Best Buy was 30 minutes away. After about 20-30 minutes of whining and complaining I gave in. We were in my car riding there, when she said, 'why are you being an asshole?' To which I replied 'how? I haven't even said anything.' Which was true because the whole car ride I was silent. 

She then said 'just stop being an asshole.' And then I gave her a mockingly 'okay!' And then she punched me in my right cheek. Closed fist punch to the face while I was driving down the highway. I had enough. I pulled onto the shoulder and I grabbed her thigh and I told her to never fucking do that ever again. And then she told me to stop being a fucking pussy. 

I threw my car back into drive and made u-turn and went back to her house. When we got in front of her house I put the car in park and said 'get out of my car.' And then she turned on the cutesy sweet girl act like she always did and the I yelled 'GET THE FUCK OUT OF MY CAR YOU CUNT'

She slapped me in the face again. I then got out of the car and started to walk to the passenger door. I was so mad I was going to rip her out of the car. She got out quickly and then I just turned back, got back into my car and sped off.

The next day I went over to her house to get my things while she was at work. I never talked to her again. 

I actually saw her a few years ago while I was hopping around the local bars when I was home visiting my parents for a long weekend. She was with some younger guy and she put on about 75lbs. It felt good to see her looking like a mess, but I felt bad for her new boyfriend. ",comment,MensRights,feminist,"Girls if you hit, slap, belittle, kick, punch, choke, throw things at, or control your boyfriends, you are the abuser."
5vwquc,"Women are not taught how to deal with feelings of anger and violence in a healthy way, and this is how it manifests. Women are assumed to not have these feelings. Men are taught from a very young age that they will have these feelings, and they need to control and channel them in healthy ways. 

Just like how men are not taught how to deal with feelings of sadness, loss, and even friendship. 

It's not OK to hit people. Teach your daughters just like you teach your sons. ",comment,MensRights,feminist,"Girls if you hit, slap, belittle, kick, punch, choke, throw things at, or control your boyfriends, you are the abuser."
5vwquc,"it doesn't even have to be from someone you love

I hate it when girls or female friends I'm talking to at bars get belligerent and overly-pushy after they've had a few drinks

i don't care that you're small/petite and i'm 6'4"", its just annoying and makes me want to avoid being around you

special shout-out to all the girls that can hold their booze with class",comment,MensRights,feminist,"Girls if you hit, slap, belittle, kick, punch, choke, throw things at, or control your boyfriends, you are the abuser."
